Podcast Name,Episode Title,Language,Published Date,Host(s),Guest(s),Main Topic(s),Rating (1-6),Rating Notes,Tags,Platform / Link
Lederpodden,🚀 Slik bygger du kultur med fart – med Mette Hopsdal,Norwegian,2026-01-01,Tor Åge Skagestad Eikerapen,Mette Hopsdal,"Kulturbygging, endringsledelse, ledelse i fart",5,Kulturbygging og endringsledelse med ekspertgjest — solid og praksisnær episode,"teamledelse,kultur",https://www.execu.no/lederpodden/294
Lederpodden,🦉 Hvordan få autoritet uten å heve stemmen – med Per Nordahl,Norwegian,2026-01-09,Tor Åge Skagestad Eikerapen,Per Nordahl,"Autoritet, kommunikasjon, ledelsesstil",5,Kommunikasjon og autoritet i lederrollen — verdifull for ledere på alle nivåer,"personalledelse,coaching",https://www.execu.no/lederpodden/295
Lederpodden,💬 Når gode råd gjør deg til en dårligere leder,Norwegian,2026-01-15,Tor Åge Skagestad Eikerapen,—,"Rådgiving, coachende ledelse, lederadferd",5,Motintuitivt og innsiktsfullt om rådgiving kontra coachende tilnærming i ledelse,coaching,https://www.execu.no/lederpodden/296
Lederpodden,🧠 Psykisk helse er blitt et lederansvar – kan KI hjelpe? Med Sondre Liverød og Espen Veierød,Norwegian,2026-01-22,Tor Åge Skagestad Eikerapen,"Sondre Liverød, Espen Veierød","Psykisk helse, lederansvar, medarbeideromsorg",5,Lederansvar for medarbeideres psykiske helse — viktig og aktuelt tema for 2026,personalledelse,https://www.lederpodden.no
Lederpodden,💡Kan empati gjøre deg til en bedre leder? – Med KG Stave,Norwegian,2026-01-30,Tor Åge Skagestad Eikerapen,KG Stave,"Empati, emosjonell intelligens, lederstil",5,Empati som lederverktøy — forskningstilknyttet og balansert fremstilling,coaching,https://www.lederpodden.no
Lederskap (NHH),"Google, Innovasjon, og Psykologisk Trygghet, med Alexander Mossin",Norwegian,2026-01-07,"Therese Egeland, Joel W. Berge",Alexander Mossin,"Psykologisk trygghet, innovasjon, Google",6,"Google-forsker på psykologisk trygghet — NHH-akademisk tyngde, essensiell for teamledelse","teamledelse,kultur",https://shows.acast.com/lederskap/episodes/google-innovasjon-og-psykologisk-trygghet-med-alexander-moss
Lederliv,"Øyvind Westby Brekke, Stø",Norwegian,2026-01-02,Ole Christian Apeland,Øyvind Westby Brekke,"Ledelse, strategi, navigering",4,Ledersamtale med Stø-direktøren — interessant men overflatenivå,personalledelse,https://shows.acast.com/lederliv/episodes/yvind-westby-brekke-st
Lederliv,"Egil Hogna, Norconsult",Norwegian,2026-01-09,Ole Christian Apeland,Egil Hogna,"Ledelse, ingeniørbransje, strategi",4,Ledersamtale med Norconsult-sjef — solid men generisk,personalledelse,https://shows.acast.com/lederliv/episodes/egil-hogna-norconsult
Lederliv,"Aina Lemoen Lunde, ANFO",Norwegian,2026-01-16,Ole Christian Apeland,Aina Lemoen Lunde,"Ledelse, markedsføring, organisasjon",4,Ledersamtale med ANFO-direktør — interessant bransjevinkel,personalledelse,https://shows.acast.com/lederliv/episodes/aina-lemoen-lunde-anfo
Lederliv,"Birgitte Ringstad Vartdal, Statkraft",Norwegian,2026-01-23,Ole Christian Apeland,Birgitte Ringstad Vartdal,"Ledelse, energibransjen, strategi",5,Statkraft-CEO om ledelse av stor energiorganisasjon — innsiktsfull og substansiell,personalledelse,https://shows.acast.com/lederliv/episodes/birgitte-ringstad-vartdal-statkraft
Lederliv,"Nina Hjellegjerde, Bellona",Norwegian,2026-01-30,Ole Christian Apeland,Nina Hjellegjerde,"Ledelse, miljøorganisasjon, motivasjon",4,Bellona-leder om ledelse i ideell sektor — nyttig perspektiv,personalledelse,https://shows.acast.com/lederliv/episodes/nina-hjellegjerde-bellona
HR-podden,"222: Slik lykkes du med rekruttering i 2026, med Hanne Revholt og Sondre Julsrud",Norwegian,2026-01-07,Anne Lise Heide,"Hanne Revholt, Sondre Julsrud","Rekruttering, talentakkvisisjon, ansettelse",5,Rekrutteringseksperter med konkrete råd for 2026 — høy praktisk verdi,"personalledelse,rekruttering",https://www.buzzsprout.com/1929646/episodes/18454127-222-slik-lykkes-du-med-rekruttering-i-2026-med-hanne-revholt-og-sondre-julsrud.mp3
HR-podden,"223: Myter og fakta om generasjoner i arbeidslivet, med Kristin Westreng Aas",Norwegian,2026-01-14,Anne Lise Heide,Kristin Westreng Aas,"Generasjonsledelse, aldersmangfold, arbeidsmiljø",5,Generasjonsforskning og ledelse av aldersmangfold — solid og aktuelt,personalledelse,https://www.buzzsprout.com/1929646/episodes/18371769-223-myter-og-fakta-om-generasjoner-i-arbeidslivet-med-kristin-westreng-aas.mp3
HR-podden,224: Nytt og nyttig om ledergruppeutvikling med Henning Bang og Thomas Nesset Midelfart,Norwegian,2026-01-21,Anne Lise Heide,"Henning Bang, Thomas Nesset Midelfart","Ledergrupper, effektivitet, teamdynamikk",6,"Norges fremste ledergruppe-eksperter — eksepsjonell for teamledelse, forskningstung",teamledelse,https://www.buzzsprout.com/1929646/episodes/18495292-224-nytt-og-nyttig-om-ledergruppeutvikling-med-henning-bang-og-thomas-nesset-midelfart.mp3
HR-podden,"225: Psykologisk trygghet i arbeidslivet, boklansering og HR-podden live - DEL 1",Norwegian,2026-01-28,Anne Lise Heide,"Bård Fyhn, Birgitte Lange, Lars Erik Lund","Psykologisk trygghet, boklansering, HR live",6,Boklansering med forsker Bård Fyhn og live-panel — essensiell episode om psykologisk trygghet,"teamledelse,kultur",https://www.buzzsprout.com/1929646/episodes/18558642-225-psykologisk-trygghet-i-arbeidslivet-boklansering-og-hr-podden-live-del-1.mp3
HR-podden,"226: Psykologisk trygghet i arbeidslivet, boklansering og HR-podden live - DEL 2",Norwegian,2026-01-29,Anne Lise Heide,"Bård Fyhn, Birgitte Lange, Lars Erik Lund","Psykologisk trygghet, Q&A, ledelse i praksis",6,Del 2 med publikumsspørsmål om psykologisk trygghet i praksis — rik og anvendbar,"teamledelse,kultur",https://www.buzzsprout.com/1929646/episodes/18558659-226-psykologisk-trygghet-i-arbeidslivet-boklansering-og-hr-podden-live-del-2.mp3
Psykologkameratene,Psykologisk førstehjelp i kriser: Hvordan hjelpe selv om du ikke er psykolog,Norwegian,2026-01-12,"Magnus Odeen, Sivert Straume",—,"Krisehåndtering, psykologisk støtte, lederansvar",4,Krisehåndtering uten psykologutdanning — nyttig for ledere som møter medarbeidere i krise,personalledelse,https://psykologkameratene.podbean.com/e/nar-viking-vinner-og-du-trenger-psykologisk-f%c3%b8rstehjelp/
Psykologkameratene,Psykemelding: Når psykiske lidelser går ut over arbeidsevnen,Norwegian,2026-01-27,"Magnus Odeen, Sivert Straume",—,"Psykisk sykefravær, arbeid og helse, lederansvar",5,Psykisk sykemelding og leders rolle — direkte relevant for personalledere,personalledelse,https://psykologkameratene.podbean.com/e/sykemelding-eller-asyl-hvordan-psykisk-helse-og-jobb-henger-sammen/
